{
  "schema_version": "1.0",
  "message_id": "00000000-0000-4000-8000-000000000004",
  "session_id": "00000000-0000-4000-8000-0000000000a1",
  "user_id": "synthetic-user-1",
  "produced_at": "2026-10-06T06:00:03.030Z",
  "kind": "decision",
  "body": {
    "last_sequence": 2,
    "event": {
      "schema_version": "1.0",
      "session_id": "00000000-0000-4000-8000-0000000000a1",
      "event_id": 1,
      "kind": "collapse_confirmed",
      "timestamp_ms": 3000,
      "onset_ms": 0,
      "onset_valid_ms": 0,
      "deviation_type": "forward_slouch",
      "reason": null
    },
    "summary": {
      "total_ms": 3000,
      "valid_ms": 3000,
      "normal_ms": 0,
      "deviation_ms": 3000,
      "rest_ms": 0,
      "away_ms": 0,
      "unknown_ms": 0,
      "missing_ms": 0,
      "collapse_count": 1,
      "alert_count": 1,
      "interval_count": 0,
      "keep_rate": 0,
      "events_per_hour": 1200,
      "mean_interval_ms": null,
      "mean_recovery_ms": null
    }
  }
}
